[{"id": "C5_architectures_training_00", "category": "C5", "domain": "architectures_training", "query": "Invent a genuinely new primitive for moving information between distant positions in a million-token sequence. It must not be a variant of softmax attention, of kernelised or linear attention, of a state-space or gated linear recurrence, of long convolutions, of block or top-k sparse selection over a stored key-value cache, or of retrieval into an external index. Name it, and give its per-token time and memory as explicit functions of sequence length. Name the three published systems it sits closest to and one mechanistic difference from each. State one falsifiable quantitative claim and the benchmark you would test it on, and one regime where it should lose to ordinary attention.", "axis_isolated": "novelty", "time_sensitivity": "pre_cutoff", "known_answers": ["Dated as of 2026-07-31. Novelty is scored ONLY against this list; every entry carries a resolvable identifier and the year of FIRST publication of the concept (not of any later rebranding).", "Softmax dot-product self-attention, the reference primitive (arXiv:1706.03762, 2017).", "Fixed sparse / strided / windowed / global attention patterns: Sparse Transformers (arXiv:1904.10509, 2019), Longformer (arXiv:2004.05150, 2020), BigBird (arXiv:2007.14062, 2020), sliding-window as shipped in Mistral 7B (arXiv:2310.06825, 2023).", "Low-rank and random-feature approximations of the attention matrix: Linformer (arXiv:2006.04768, 2020), Performer (arXiv:2009.14794, 2020).", "Hash/bucket-based approximate attention: Reformer LSH attention (arXiv:2001.04451, 2020).", "Linear attention as an RNN with matrix-valued state (arXiv:2006.16236, 2020). CONCEPT DATE NOTE: the underlying outer-product fast-weight memory is Schmidhuber's fast-weight controller (doi:10.1162/neco.1992.4.1.131, 1992); the equivalence is made explicit in arXiv:2102.11174 (2021).", "Structured state-space sequence models and their gated/selective successors: S4 (arXiv:2111.00396, 2021), Mamba (arXiv:2312.00752, 2023), Griffin gated linear recurrence + local attention (arXiv:2402.19427, 2024), MiniMax-01 lightning attention (arXiv:2501.08313, 2025).", "Gated / delta-rule linear recurrences: RWKV (arXiv:2305.13048, 2023), RetNet (arXiv:2307.08621, 2023), Gated Linear Attention (arXiv:2312.06635, 2023), parallel DeltaNet (arXiv:2406.06484, 2024), Gated DeltaNet (arXiv:2412.06464, 2024), log-linear attention (arXiv:2506.04761, 2025).", "Implicit long-convolution and token-mixing operators: Hyena (arXiv:2302.10866, 2023), Monarch Mixer (arXiv:2310.12109, 2023), FNet Fourier mixing (arXiv:2105.03824, 2021), MLP-Mixer (arXiv:2105.01601, 2021).", "Associative / content-addressable memory as the mixing operator: product-key memory layers (arXiv:1907.05242, 2019), Memory Layers at Scale (arXiv:2412.09764, 2024), and the attention-equivalent continuous Hopfield layer (arXiv:2008.02217, 2020). CONCEPT DATE NOTE: the associative-memory concept is Hopfield (doi:10.1073/pnas.79.8.2554, 1982) and dense associative memory is Krotov and Hopfield (arXiv:1606.01164, 2016); 2020 is the transformer-attention equivalence, not the concept.", "Segment-recurrent and compressive carry-over of past activations: Transformer-XL (arXiv:1901.02860, 2019), Compressive Transformer (arXiv:1911.05507, 2019), Recurrent Memory Transformer (arXiv:2207.06881, 2022), Infini-attention (arXiv:2404.07143, 2024).", "kNN / landmark retrieval folded into the attention operator: Memorizing Transformers (arXiv:2203.08913, 2022), Landmark Attention (arXiv:2305.16300, 2023), retrieval-augmented generation over an external index (arXiv:2005.11401, 2020).", "Learned, natively trainable sparse selection over the KV cache: Native Sparse Attention (arXiv:2502.11089, 2025), MoBA block attention (arXiv:2502.13189, 2025), and the trade-off study in The Sparse Frontier (arXiv:2504.17768, 2025).", "Fast weights updated by an inner learning loop at test time as the sequence mixer: TTT layers (arXiv:2407.04620, 2024), Titans neural long-term memory (arXiv:2501.00663, first posted 31 Dec 2024).", "Latent-bottleneck cross-attention that decouples cost from input length: Perceiver (arXiv:2103.03206, 2021).", "External differentiable memory with learned read/write heads: Neural Turing Machines (arXiv:1410.5401, 2014), Differentiable Neural Computer (doi:10.1038/nature20101, 2016).", "KV-side capacity reductions that change what is stored per position: multi-query attention (arXiv:1911.02150, 2019), grouped-query attention (arXiv:2305.13245, 2023), multi-head latent attention (arXiv:2405.04434, 2024).", "Positional-encoding schemes that extend range without changing the mixing operator: RoPE (arXiv:2104.09864, 2021), ALiBi (arXiv:2108.12409, 2021).", "Exact-attention systems reformulations (same math, different IO/parallelism): FlashAttention (arXiv:2205.14135, 2022), Ring Attention (arXiv:2310.01889, 2023), PagedAttention (doi:10.1145/3600006.3613165, 2023).", "The recall-versus-throughput trade-off result that constrains any constant-state design, plus the hybrid it motivates (arXiv:2402.18668, 2024).", "Measurement conventions for long-context claims: RULER (arXiv:2404.06654, 2024), long-context data engineering to 128k (arXiv:2402.10171, 2024).", "Hierarchical / multi-resolution mixing that summarises the sequence at coarser scales: Funnel-Transformer (arXiv:2006.03236, 2020), H-Transformer-1D hierarchical-matrix attention (arXiv:2107.11906, 2021), Hourglass hierarchical transformers (arXiv:2110.13711, 2021), multi-resolution-analysis attention (arXiv:2207.10284, 2022), MEGABYTE multiscale patching (arXiv:2305.07185, 2023). Fast-multipole-style hierarchical summarisation over positions is covered here.", "Learned reordering, clustering, or permutation that brings distant positions adjacent before mixing: Routing Transformer (arXiv:2003.05997, 2020), Sparse Sinkhorn Attention (arXiv:2002.11296, 2020), Nystromformer landmark approximation (arXiv:2102.03902, 2021).", "Global mixing by iterating to a fixed point rather than by an explicit pairwise operator: Deep Equilibrium Models (arXiv:1909.01377, 2019); Universal Transformers as weight-tied depth recurrence (arXiv:1807.03819, 2018).", "Block-level recurrence carrying a state across chunks: Block-Recurrent Transformers (arXiv:2203.07852, 2022)."], "hard_rules": ["Gives the primitive an explicit name AND states per-token time cost and per-token memory cost as formulas in the sequence length n (both formulas must be present).", "The defining operation is not softmax attention, kernelised/linear attention, a linear state-space or gated linear recurrence, a long convolution, block or top-k sparse selection over a stored KV cache, or retrieval into an external index; naming these for contrast is allowed, building on them as the core mechanism is not.", "Names at least three specific published systems or papers as nearest prior art and states one concrete mechanistic difference from each.", "States at least one falsifiable quantitative claim containing a numeral and names the benchmark, dataset, or measurement used to test it.", "States at least one regime, sequence length, or task family in which the primitive is expected to be worse than exact softmax attention."], "expert_baseline": "Competent experts converge on framing commitments rather than a device: per-token cost must be constant or near-constant in sequence length, some lossy compression of the distant past is unavoidable, and long-range quality is bounded by how many bits the retained state holds, so the design question is where to spend a fixed state budget. The expected response therefore argues from the recall-versus-throughput trade-off, fixes an explicit state size, specifies read and write costs separately, is honest that exact recall over 1M tokens cannot be bought with a constant state, and validates on synthetic needle-style and aggregation-style long-context suites at 128k to 1M tokens before claiming any win over exact attention. Note that the specific fix most experts reach for first, a constant-size recurrent state plus a local exact-attention window, is itself prior art here and is excluded by this item's own constraints."},